{
  "page_type": "concept",
  "name": "Output Window",
  "category": "DBC",
  "subcategory": "windows",
  "title": "Output Window",
  "source": "chm_extract_v15/CANeds/Topics/windows/HIDD_MSG_FORMVIEW.htm",
  "intro": [
    "In the output window status, error and warning notifications are shown.",
    "A click with the right mouse button into the output window opens a context menu. Command Clear clears the whole window and command Copy copies the contents to the clipboard.",
    "Via double clicking, an error or warning notification the corresponding object or page is selected and the attribute can be edited. The same result is achieved by selecting the wanted error notification; opening context menu via right mouse click and selecting command Go to Error. The command Help of the context menu shows a more detailed error description.",
    "The commands Find in output window and Find Next of menu View look for a character string in this window.",
    "To give more places to all other windows the output window has the ability to float which means it is no longer docked to the frame window. By double clicking the gripper at the left of the docked window or a click on the quadratic toggle box, the window changes its state from docked to float. If the window is floating a double click on the caption of the window or shifting the window to the edge of the frame window docks the output window to the frame window.",
    "Floating of the Output Window"
  ],
  "intro_tables": [
    [
      [
        "Version 15© Vector Informatik GmbH"
      ]
    ]
  ],
  "intro_code_blocks": [],
  "sections": []
}
