{
  "page_type": "concept",
  "name": "Command Help | CANeds license",
  "category": "DBC",
  "subcategory": "menus",
  "title": "Command Help | CANeds license",
  "source": "chm_extract/CANeds/Topics/menus/help/menuHelpLicense.htm",
  "intro": [
    "Shows the end user license agreement for CANeds."
  ],
  "intro_tables": [
    [
      [
        "Version 12.0© Vector Informatik GmbH"
      ]
    ]
  ],
  "intro_code_blocks": [],
  "sections": []
}
