{
  "page_type": "function",
  "name": "AvbGetMediaType",
  "category": "IP",
  "title": "AvbGetMediaType",
  "source": "chm_extract/CANoeCANalyzer/Topics/CAPLfunctions/IP/AVBIL/Functions/CAPLfunctionAvbGetMediaType.htm",
  "syntax": [
    "dword AvbGetMediaType(dword listenerOrTalkerHandle);"
  ],
  "description": [
    "Gets the media type for a Listener or a Talker."
  ],
  "parameters": [],
  "return": "0: The function failed. Call AvbGetLastError to get a more specific error code.",
  "example": {
    "description": [],
    "code": ""
  },
  "availability": [
    [
      "Since Version"
    ]
  ],
  "selectors": [],
  "note": [],
  "complexity": ""
}
