{
  "page_type": "function",
  "name": "DoIP_UDPSendPort",
  "category": "Diagnostics",
  "title": "DoIP_UDPSendPort",
  "source": "chm_extract_v15/CANoeCANalyzer/Topics/CAPLFunctions/Diagnostics/Functions/CAPLfunctionDoIPUDPSendPort.htm",
  "syntax": [
    "ong DoIP_UDPSendPort(char IPaddress[], dword port, dword payloadType, byte payload[], dword payloadLen);"
  ],
  "description": [
    "Sends a DoIP PDU with valid layout to peer(s) as UDP frame. The configured DoIP version is used."
  ],
  "parameters": [
    {
      "name": "IPaddress",
      "type": "",
      "description": "Send to this address, may be a broadcast address."
    },
    {
      "name": "port",
      "type": "",
      "description": "Destination port for the UDP packet."
    },
    {
      "name": "payloadType",
      "type": "",
      "description": "Type to send, i.e. this can be any value. [0; 0xFFFF]"
    },
    {
      "name": "payload",
      "type": "",
      "description": "The data following the generic DoIP header."
    },
    {
      "name": "payloadLen",
      "type": "",
      "description": "Payload length."
    }
  ],
  "return": "Error code",
  "example": {
    "description": [],
    "code": "// Send an invalid identification request to a non-standard port of a \n// specific vehicle that must ignore it\nBYTE rawData[8] = { 0x02,0xFF /*wrong!*/, 0x00,0x01, 0x00,0x00,0x00,0x00};\nDoIP_UDPSendPort( \"169.254.123.45\", 13401 /* non standard */, rawData, elcount( rawData));"
  },
  "availability": [
    [
      "CANalyzer",
      "CANoe",
      "CANoe4SW Server Edition (Windows)",
      "CANoe4SW Server Edition (Linux)",
      "CANoe4SW",
      "vTESTstudio"
    ],
    [
      "Since Version",
      "—",
      "9.0",
      "—",
      "—",
      "—",
      "2.1"
    ],
    [
      "Restricted To",
      "—",
      "—",
      "—",
      "—",
      "—",
      "—"
    ],
    [
      "CANalyzer Measurement Setup (Transmit Branch)",
      "—",
      "N/A",
      "N/A",
      "N/A",
      "N/A",
      "N/A"
    ],
    [
      "CANoe Measurement Setup / CANalyzer Analysis Branch",
      "—",
      "—",
      "—",
      "—",
      "N/A",
      "N/A"
    ],
    [
      "CANoe Simulation Setup",
      "N/A",
      "✔",
      "—",
      "—",
      "N/A",
      "N/A"
    ],
    [
      "CANoe System and Communication Setup",
      "N/A",
      "—",
      "—",
      "—",
      "—",
      "N/A"
    ],
    [
      "CANoe Test Setup for Test Modules",
      "N/A",
      "✔",
      "—",
      "—",
      "N/A",
      "N/A"
    ],
    [
      "CANoe Test Setup for Test Units",
      "N/A",
      "✔",
      "—",
      "—",
      "—",
      "N/A"
    ],
    [
      "32-Bit",
      "—",
      "✔",
      "—",
      "N/A",
      "—",
      "N/A"
    ],
    [
      "64-Bit",
      "—",
      "✔",
      "—",
      "—",
      "—",
      "N/A"
    ]
  ],
  "selectors": [],
  "note": [],
  "complexity": ""
}
