{
  "page_type": "method",
  "name": "ethernetPacket::GetInt64",
  "category": "IP",
  "title": "ethernetPacket::GetInt64",
  "source": "chm_extract_v15/CANoeCANalyzer/Topics/CAPLFunctions/IP/Methods/CAPLfunctionGetInt64.htm",
  "syntax": [
    "int ethernetPacket.GetInt64(char protocol[], char field[]);"
  ],
  "description": [
    "Returns the value of the specified field as int64.",
    "If protocol or field is not contained in the packet, the measurement is stopped with a runtime error. ethernetPacket::IsAvailable can be used to find out if the field is available."
  ],
  "parameters": [
    {
      "name": "protocol",
      "type": "",
      "description": "Name of the protocol."
    },
    {
      "name": "field",
      "type": "",
      "description": "Name of the field."
    }
  ],
  "return": "Value of the field.",
  "example": {
    "description": [],
    "code": "on ethernetPacket *\n{\n  if(this.IsAvailable(\"ipv4\", \"source\"))\n  {\n    Write(\"ipv4.source has value 0x%lX\", this.GetInt64(\"ipv4\", \"source\"));\n  }\n}"
  },
  "availability": [
    [
      "CANalyzer",
      "CANoe",
      "CANoe4SW Server Edition (Windows)",
      "CANoe4SW Server Edition (Linux)",
      "CANoe4SW",
      "vTESTstudio"
    ],
    [
      "Since Version",
      "13.0 SP2",
      "13.0 SP2",
      "13.0",
      "—",
      "—",
      "5.0 SP2"
    ],
    [
      "Restricted To",
      "Ethernet",
      "Ethernet",
      "Ethernet",
      "—",
      "—",
      "Ethernet"
    ],
    [
      "CANalyzer Measurement Setup (Transmit Branch)",
      "✔",
      "N/A",
      "N/A",
      "N/A",
      "N/A",
      "N/A"
    ],
    [
      "CANoe Measurement Setup / CANalyzer Analysis Branch",
      "✔",
      "✔",
      "✔",
      "—",
      "N/A",
      "N/A"
    ],
    [
      "CANoe Simulation Setup",
      "N/A",
      "✔",
      "✔",
      "—",
      "N/A",
      "N/A"
    ],
    [
      "CANoe System and Communication Setup",
      "N/A",
      "✔",
      "✔",
      "—",
      "—",
      "N/A"
    ],
    [
      "CANoe Test Setup for Test Modules",
      "N/A",
      "✔",
      "✔",
      "—",
      "N/A",
      "N/A"
    ],
    [
      "CANoe Test Setup for Test Units",
      "N/A",
      "✔",
      "✔",
      "—",
      "—",
      "N/A"
    ],
    [
      "32-Bit",
      "✔",
      "✔",
      "✔",
      "N/A",
      "—",
      "N/A"
    ],
    [
      "64-Bit",
      "✔",
      "✔",
      "✔",
      "—",
      "—",
      "N/A"
    ]
  ],
  "selectors": [],
  "note": [],
  "complexity": ""
}
