{
  "page_type": "function",
  "name": "HILAPIDestroySignalGenerator",
  "category": "Test",
  "title": "HILAPIDestroySignalGenerator",
  "source": "chm_extract_v15/CANoeCANalyzer/Topics/CAPLFunctions/Test/Functions/CAPLfunctionHILAPIDestroySignalGenerator.htm",
  "syntax": [
    "dword HILAPIDestroySignalGenerator(dword handle);"
  ],
  "description": [
    "Destroys an instance of a Signal Generator."
  ],
  "parameters": [
    {
      "name": "handle",
      "type": "",
      "description": "The handle of the Signal Generator."
    }
  ],
  "return": "",
  "example": {
    "description": [
      "Destroys an instance of a ASAM HILAPI Signal Generator:"
    ],
    "code": "HILAPIDestroySignalGenerator( hGenerator);"
  },
  "availability": [
    [
      "CANalyzer",
      "CANoe",
      "CANoe4SW Server Edition (Windows)",
      "CANoe4SW Server Edition (Linux)",
      "CANoe4SW",
      "vTESTstudio"
    ],
    [
      "Since Version",
      "—",
      "8.0",
      "13.0",
      "—",
      "—",
      "1.0"
    ],
    [
      "Restricted To",
      "—",
      "—",
      "—",
      "—",
      "—",
      "—"
    ],
    [
      "CANalyzer Measurement Setup (Transmit Branch)",
      "—",
      "N/A",
      "N/A",
      "N/A",
      "N/A",
      "N/A"
    ],
    [
      "CANoe Measurement Setup / CANalyzer Analysis Branch",
      "—",
      "—",
      "—",
      "—",
      "N/A",
      "N/A"
    ],
    [
      "CANoe Simulation Setup",
      "N/A",
      "✔",
      "✔",
      "—",
      "N/A",
      "N/A"
    ],
    [
      "CANoe System and Communication Setup",
      "N/A",
      "✔",
      "✔",
      "—",
      "—",
      "N/A"
    ],
    [
      "CANoe Test Setup for Test Modules",
      "N/A",
      "✔",
      "✔",
      "—",
      "N/A",
      "N/A"
    ],
    [
      "CANoe Test Setup for Test Units",
      "N/A",
      "✔",
      "✔",
      "—",
      "—",
      "N/A"
    ],
    [
      "32-Bit",
      "—",
      "✔",
      "✔",
      "N/A",
      "—",
      "N/A"
    ],
    [
      "64-Bit",
      "—",
      "✔",
      "✔",
      "—",
      "—",
      "N/A"
    ]
  ],
  "selectors": [],
  "note": [],
  "complexity": ""
}
