{
  "page_type": "concept",
  "name": "Unknown section attributes",
  "category": "DBC",
  "subcategory": "object_attributes",
  "title": "Unknown section attributes",
  "source": "chm_extract_v15/CANeds/Topics/object_attributes/HIDD_FV_UNKNOWNSECT.htm",
  "intro": [
    "If there are any sections in the EDS file which are not conform to the EDS specification are not mentioned in one of the list sections (e.g. [MandatoryObjects]) these sections are represented by Unknown section objects in the Object Dictionary page of the main window.",
    "Comments (which start with a semicolon) at the beginning of an EDS file are also represented by Unknown section objects.",
    "In the attribute window the section name and all entries of the section are listed using the INI-file format (name=value)."
  ],
  "intro_tables": [
    [
      [
        "Version 15© Vector Informatik GmbH"
      ]
    ]
  ],
  "intro_code_blocks": [],
  "sections": []
}
