{
  "page_type": "function",
  "name": "C2xStartNode",
  "category": "Car2x",
  "title": "C2xStartNode",
  "source": "chm_extract_v15/CANoeCANalyzer/Topics/CAPLFunctions/Car2x/Functions/CAPLfunctionC2xStartNode.htm",
  "syntax": [
    "long C2xStartNode(); //form 1",
    "long C2xStartNode(char* nodeName); //form 2"
  ],
  "description": [],
  "parameters": [
    {
      "name": "nodeName",
      "type": "",
      "description": "Name of the node that starts the transmission"
    }
  ],
  "return": "",
  "example": {
    "description": [],
    "code": "//form 1\nC2xStartNode();\n//form 2\nC2xStartNode(“Node1”);"
  },
  "availability": [
    [
      "CANalyzer",
      "CANoe",
      "CANoe4SW Server Edition (Windows)",
      "CANoe4SW Server Edition (Linux)",
      "CANoe4SW",
      "vTESTstudio"
    ],
    [
      "Since Version",
      "—",
      "13.0: form 1, 2",
      "—",
      "—",
      "—",
      "5.0: : form 1, 2"
    ],
    [
      "Restricted To",
      "—",
      "Car2x: form 1 Car2x, Testnodes: form 2",
      "—",
      "—",
      "—",
      "Car2x: form 1 Car2x, Testnodes: form 2"
    ],
    [
      "CANalyzer Measurement Setup (Transmit Branch)",
      "—",
      "N/A",
      "N/A",
      "N/A",
      "N/A",
      "N/A"
    ],
    [
      "CANoe Measurement Setup / CANalyzer Analysis Branch",
      "—",
      "—",
      "—",
      "—",
      "N/A",
      "N/A"
    ],
    [
      "CANoe Simulation Setup",
      "N/A",
      "✔",
      "—",
      "—",
      "N/A",
      "N/A"
    ],
    [
      "CANoe System and Communication Setup",
      "N/A",
      "✔",
      "—",
      "—",
      "—",
      "N/A"
    ],
    [
      "CANoe Test Setup for Test Modules",
      "N/A",
      "✔",
      "—",
      "—",
      "N/A",
      "N/A"
    ],
    [
      "CANoe Test Setup for Test Units",
      "N/A",
      "✔",
      "—",
      "—",
      "—",
      "N/A"
    ],
    [
      "32-Bit",
      "—",
      "✔",
      "—",
      "N/A",
      "—",
      "N/A"
    ],
    [
      "64-Bit",
      "—",
      "✔",
      "—",
      "—",
      "—",
      "N/A"
    ]
  ],
  "selectors": [],
  "note": [],
  "complexity": ""
}
