{
  "page_type": "function",
  "name": "AREthOutputMessage",
  "category": "IP",
  "title": "AREthOutputMessage",
  "source": "chm_extract_v15/CANoeCANalyzer/Topics/CAPLFunctions/IP/AUTOSARethIL/Functions/CAPLfunctionAREthOutputMessage.htm",
  "syntax": [
    "long AREthOutputMessage( dword aepHandle, dword remoteIPv4Address, dword remotePort, dword messageHandle ); // form 1",
    "long AREthOutputMessage( dword aepHandle, IP_Endpoint remoteIPEndpoint, dword messageHandle); // form 2"
  ],
  "description": [
    "This function is used to send a SOME/IP message.",
    "The packet is sent immediately. All messages that were prepared for sending beforehand with AREthPostMessage are inserted in the packet to be sent and sent with the message, provided that the buffered messages have the same source and the same destination."
  ],
  "parameters": [
    {
      "name": "aepHandle",
      "type": "",
      "description": "Handle of the local Application Endpoint over which the message should be output."
    },
    {
      "name": "remoteIPv4Address",
      "type": "",
      "description": "IPv4 address to which the message should be sent (Network Byte Order)."
    },
    {
      "name": "remotePort",
      "type": "",
      "description": "UDP/TCP port number to which the message should be sent."
    },
    {
      "name": "remoteIPEndpoint",
      "type": "",
      "description": "Object of type IP_Endpoint that contains the address/port of the remote endpoint."
    },
    {
      "name": "messageHandle",
      "type": "",
      "description": "Handle of the message that was created with AREthCreateMessage, for example."
    }
  ],
  "return": "IPv4 address to which the message should be",
  "example": {
    "description": [],
    "code": "on key 's'\n{\n  dword messageId = 0x12340004; // service ID = 0x1234, method ID = 0x0004\n  dword requestId = 0; // client ID = 0, session ID = 0\n  dword protocolVersion = 1;\n  dword interfaceVersion = 1;\n  dword messageType = 0x2; // notification message\n  dword returnCode = 0; // not available\n  dword aep = 0; // application endpoint handle\n  dword messageHandle = 0; // handle of the created SOME/IP message\n  BYTE payload[5]; // the message payload\n  dword count = 0; // a simple counter\n\n  // initialize the payload\n  count = 0;\n  payload[count++] = 0x11;\n  payload[count++] = 0x22;\n  payload[count++] = 0x33;\n  payload[count++] = 0x44;\n  payload[count++] = 0x55;\n\n  // open application endpoint\n  aep = AREthOpenLocalApplicationEndpoint(17, 50002);\n\n  // create the SOME/IP message itself and set the message payload\n  messageHandle = AREthCreateMessage(messageId,requestId,protocolVersion,interfaceVersion,messageType,returnCode);\n  AREthSetData(messageHandle,elcount(payload),payload);\n\n  // send the SOME/IP message\n  AREthOutputMessage(aep,0xFFFFFFFF,40001,messageHandle);\n\n  // release the some IP message\n  AREthReleaseMessage(messageHandle);\n}"
  },
  "availability": [
    [
      "CANalyzer",
      "CANoe",
      "CANoe4SW Server Edition (Windows)",
      "CANoe4SW Server Edition (Linux)",
      "CANoe4SW",
      "vTESTstudio"
    ],
    [
      "Since Version",
      "—",
      "9.0 SP2: form 1 12.0 SP2: form 2",
      "—",
      "—",
      "—",
      "2.1 SP3: form 1 4.0 SP2: form 2"
    ],
    [
      "Restricted To",
      "—",
      "Ethernet",
      "—",
      "—",
      "—",
      "Ethernet"
    ],
    [
      "CANalyzer Measurement Setup (Transmit Branch)",
      "—",
      "N/A",
      "N/A",
      "N/A",
      "N/A",
      "N/A"
    ],
    [
      "CANoe Measurement Setup / CANalyzer Analysis Branch",
      "—",
      "—",
      "—",
      "—",
      "N/A",
      "N/A"
    ],
    [
      "CANoe Simulation Setup",
      "N/A",
      "✔",
      "—",
      "—",
      "N/A",
      "N/A"
    ],
    [
      "CANoe System and Communication Setup",
      "N/A",
      "✔",
      "—",
      "—",
      "—",
      "N/A"
    ],
    [
      "CANoe Test Setup for Test Modules",
      "N/A",
      "✔",
      "—",
      "—",
      "N/A",
      "N/A"
    ],
    [
      "CANoe Test Setup for Test Units",
      "N/A",
      "✔",
      "—",
      "—",
      "—",
      "N/A"
    ],
    [
      "32-Bit",
      "—",
      "✔",
      "—",
      "N/A",
      "—",
      "N/A"
    ],
    [
      "64-Bit",
      "—",
      "✔",
      "—",
      "—",
      "—",
      "N/A"
    ]
  ],
  "selectors": [],
  "note": [],
  "complexity": ""
}
